{"cache_dir":"/tmp/provider-cache","max_bytes":1024,"offline":false,"output_dir":"/tmp/source","receipt_path":"/tmp/receipt.json","selector":{"dataset":{"name":"numbers","source":"test","version":"1"},"registry":{"index_sha256":"1111111111111111111111111111111111111111111111111111111111111111","index_url":"https://example.invalid/index.json","release":"metewand-test-1","schema_version":1},"verification":"decoded","version":1},"version":1}